title,skills,salary,company,description,link
Python Backend Developer,"MySQL,SQL,GitHub,Python,PostgreSQL,React,Docker,Docker Compose,Redis,Flask,RabbitMQ,Celery,SQLAlchemy,PyTest,FastAPI,Пользователь ОС Linux,Unit-тестирование",54300–76900 UAH,AbeloHost B.V.,"AbeloHost  нідерландська хостинг компанія. З 2012 року наша команда експертів надає надійні, доступні та практичні хостингові рішення, які можуть використовуватись довгі роки.  Ми створили саме адаптивне бухгалтерське рішення на ринку, ґрунтуючись на багаторічному реальному досвіді онлайн-бізнесу і зараз ми шукаємо досвідченого Frontend розробника зі знанням React для розробки клієнтської частини проекту. Ми надамо не лише цінний досвід роботи, а й перспективи професійного та кар'єрного зростання. Вакансія відкрита для різних рівнів фахівців, тому, будь ласка, вкажіть свій рівень, щоб ми передали резюме у відповідний департамент: Junior, Middle, Senior, Lead. Знання та вимоги:    Python 3.10+;  Mysql/Postgresql + Sqlalchemy + Good Knowledge of SQL Queries;  FastAPI/Flask;  Linux (Debian, CentOS);  Docker/Docker Compose;  Celery;  Redis/RabbitMQ;  Microservice Architecture;  Pytest/Unittest;  Знання Information Security ( https://owasp.org/www-project-top-ten/ );  Problem Solving skills;  Вміння комунікувати з людьми з різних галузей (бухгалтерія, дизайн, фронтенд тощо) та вникати в контекст завдання;  Бажання вчитися та розвиватися.  Буде плюсом:    Досвід роботи з Quickbooks Online (у ролі користувача чи розробника API);  Хороші знання Excel/Google Sheets;  Досвід роботи з бухгалтерією (Знання що таке Invoice, Estimate, Bill тощо);  Apache Superset/Microsoft PowerBI;  Досвід роботи з Paypal API, Stripe API та іншими подібними системами;  Вміння читати та розбиратися в чужому коді, переробка Legacy коду;Grafana/ELK.  Обов’язки:    Розробка архітектури сервісів;  ⁠Переробка старого (Legacy) коду;  Додавання функціоналу для нових клієнтів;  Розробка звітів для нових клієнтів;  Тестування та виправлення багів;  Участь у всіх процесах обговорення та розробки продукту.  Умови роботи:    Віддалена робота;  Укладання фріланс контракту;  Заробітна плата: €1200 — €1700/місяць в залежності від вашого поточного рівня (зростатиме в міру отримання досвіду);  Бонусна система.  Наша компанія розвивається динамічно. Шукаємо тих, хто готовий розвиватися разом із нами та шукає перспективу для свого зростання.  Якщо Ви вважаєте, що підходите нам і зацікавлені в цій можливості, надішліть нам відгук разом з посиланням на GitHub.",https://www.work.ua/en/jobs/5748761/
"Python, Django Developer","SQL,Git,Python,PostgreSQL,Відповідальність,Docker,Docker Compose,Django,Selenium,Уважність",,Ван Медіа Імперія,"Проект передбачає розробку веб-додатків на основі Django з інтеграцією з іншими системами через API. Також необхідно автоматизувати задачі за допомогою Selenium та Telegram-бота на основі Telethon. Інфраструктура проекту базується на Docker з використанням PostgreSQL як бази даних.  Обов’язки: 1. Розробка веб-додатків на основі Django:  Створення моделей, в’юшок та шаблонів.  Реалізація CRUD операцій для основних моделей даних.  Написання тестів для забезпечення якості коду.  2. Інтеграція з іншими системами через API:  Розробка та підтримка RESTful API.  Забезпечення безпеки API (аутентифікація, авторизація).  3. Автоматизація задач за допомогою Selenium:  Створення скриптів для автоматизованого тестування веб-додатків.  Інтеграція скриптів автоматизації в CI/CD процеси.  4. Розробка Telegram-ботів за допомогою Telethon:  Створення та налаштування Telegram-ботів.  Автоматизація взаємодії з користувачами через Telegram.  5. Інфраструктура на основі Docker:  Контейнеризація додатків.  Написання Dockerfile та docker-compose.yml для налаштування середовища розробки та продакшену.  6. Використання PostgreSQL як бази даних:  Створення та оптимізація схем баз даних.  Написання складних SQL-запитів для витягування даних.  Вимоги до кандидата: 1. Професійні навички:  Глибоке знання Python та Django.  Досвід роботи з Selenium для автоматизації веб-додатків.  Вміння працювати з Telethon для розробки Telegram-ботів.  Досвід роботи з Docker для контейнеризації додатків.  Знання PostgreSQL та вміння працювати з базами даних.  2. Додаткові навички:  Досвід роботи з CI/CD інструментами.  Знання принципів об'єктно-орієнтованого програмування та дизайну.  Вміння працювати з системами контролю версій (Git).  3. М’які навички:  Здатність працювати в команді та комунікувати з іншими розробниками.  Вміння самостійно вирішувати проблеми та знаходити оптимальні рішення.  Відповідальність та увага до деталей.  Якщо це про тебе і хочеш приєднатись до нашої команди — заповнюй форму:  https://forms.gle/DxJbAV3EkMVMWzkLA   Якщо є питання — пиши:  https://t.me/anastasiia_ArbitrageUp",https://www.work.ua/en/jobs/5739159/
Senior FullStack Engineer (Python/React),"Python,React,AWS",,UKEESS Software House,"The team of UKEESS Software House is currently looking for a Senior FullStack Engineer (Python/React)  to join our team for a full-time position (remotely in Ukraine or in Lviv’s office). About the Customer and the Project: Our customer is the world’s largest DNA network from the USA. This presents a unique opportunity to work with more than 30 billion digitized global historical records, 100 million family trees, and 18+ million people in their growing database. Our customers help people discover their family stories and gain actionable insights about their health and wellness.  About the team: As part of the Data Science Engineering Team, you will be responsible for deploying and operating data science models designed to extract data from images. This includes image classification, image segmentation, handwriting recognition, and natural language processing. The team accepts the models from data scientists as Python applications using the SageMaker Model Registry. Additionally, we build and maintain web applications for model output visualization.  Responsibilities will include:  Maintaining infrastructures and environments of all types, from dev to production  Work with Data Scientists, Data Engineers, Software Engineers, and Product teams  Work on and guide microservice REST API design  Write key algorithms to maximize scalability and reliability  Focus on and working with throughput, scale, cost, and error handling  Write code and unit tests  Conduct code reviews  Diagnose complex problems involving multiple systems and technologies  Security monitoring and administration  Identify opportunities to adopt innovative technologies  Requirements:  6+ years of commercial experience with Python  3+ years of commercial experience with React  3+ years of commercial experience with AWS (SQS, SNS, S3, and Lambdas)  Commercial experience with relational database   3+ years of commercial experience with customer-facing operations, including monitoring, cost analysis, and troubleshooting production issues  English: Upper-intermediate at least (both spoken and written)  It will be a plus:  Bachelor’s degree in a related field or equivalent experience  Terraform and Data Science experience   What do we offer our new colleague?  Competitive compensation (based on market data but also depending on the technical level of the candidate)  Flexible work schedule  3 health packages to choose  Annual paid vacation and state holiday celebration  Free English classes (online)  Individual approach to professional growth  Lack of bureaucracy and micromanagement  Modern, comfortable office facilities (a barbecue zone, kitchens, lounge rooms, coffee machines, etc.)  Foreign business trips (after the war)  On-site parking lot and charge station for Electric Cars  Corporate gifts, celebrations, and fun activities  Sports activities: ping-pong, soccer, work-out  If you have a passion for solving challenging problems; building scalable, robust systems; love working with the latest technologies in a fast-paced, flexible environment; and are excited at the prospect of having a significant impact on products which has more than 3 million paying subscribers, then we want to talk to you! ;-)",https://www.work.ua/en/jobs/5750471/
Викладач у дитячу ІТ-школу програмування (Python),"Python,Активність,Програмування,Креативність,Викладання,Творчий підхід",6000–12000 UAH,"Logika, мiжнародна школа програмування для дiтей","Контакти:   Тел.  +380938659605 Show phone  (Діана) Що таке Logika: Ми впроваджуємо новітні IT технології в навчання школярів. На наших уроках діти не лише вчаться основам програмування, вони розвивають логіку і вміння думати, а в проектній роботі проявляють креативність та творчі здібності. У програму курсу Logika включені частини курсів з фізики, математики, хімії, астрономії, що допомагає дітям зрозуміти, навіщо шкільні предмети потрібні в реальному житті. Logika активно розвивається і в зв’язку із розширеннями відбувається пошук викладачів! Ми пропонуємо:  Робота у вихідні.  Заробітна плата: 450 грн / 1.5 години викладання.  Постійне навчання за рахунок компанії від наших професіоналів.  Зручні локації.  Круте ком’юніті однодумців!  Хто нам потрібен?:  Потрібні круті викладачі, які ладнають із комп’ютером на «ти» та мають активний підхід до своєї роботи.  Необхідні знання у Python. (Або ж досвід із іншими мовами програмування та бажання вивчати нове)  Великою перевагою буде вища освіта в області ІТ, або ж педагогіки/психології.  Якщо Ви маєте досвід у роботі з дітками — це кльово, а якщо немає, то навчимо!  Що потрібно буде робити:  проводити заняття із використанням уже готових методичних матеріалів школи Logika;  створювати та підтримувати дружню робочу атмосферу;  отримувати кайф від роботи із майбутнім нашої країни;  Іноді таки доведеться подавати невеличкі звіти.  Не втрачай можливість — хутчіш залишай відгук, або ж телефонуй!  Тел.  +380938659605 Show phone  (Діана)",https://www.work.ua/en/jobs/4622177/
Junior Python Developer,"SQL,Git,Python,Знання принципів ООП,Робота в команді,Здатність до навчання,Адаптивність,Blockchain",30000–35000 UAH,Soft Performance,"Вакансия: Junior Python Developer О компании: Мы — динамично развивающееся blockchain агентство, специализирующееся на работе с криптопроектами. В связи с расширением нашей молодой и перспективной команды, мы ищем талантливого Junior Python разработчика. Обязанности:  Разработка и поддержка приложений на Python.  Участие в проектировании и разработке новых функциональностей.  Работа с базами данных и интеграция с различными API.  Оптимизация и улучшение существующего кода.  Участие в командных проектах и совместная работа над задачами.  Требования:  Базовые знания Python и опыт работы с ним.  Понимание основных принципов ООП.  Знание SQL и опыт работы с базами данных.  Умение работать с системами контроля версий (например, Git).  Способность быстро обучаться и адаптироваться к новым задачам.  Умение работать в команде и готовность к взаимодействию с коллегами.  Будет плюсом:  Знание английского языка на уровне, достаточном для чтения технической документации.  Условия работы:  Полная занятость с 11:00 до 19:30, с понедельника по субботу.  Работа в офисе, который оборудован генератором для бесперебойной работы.  Заработная плата от 30 000 грн + процент с продаж.  Выплаты заработной платы каждые две недели.  Дружелюбная и поддерживающая атмосфера в коллективе.  Что мы предлагаем:  Интересные и разнообразные проекты в сфере blockchain и криптовалют.  Работа в молодой и энергичной команде профессионалов.  Возможность профессионального и карьерного роста.  Дружелюбная атмосфера и поддержка коллег.  Если вы хотите стать частью нашей команды и развиваться вместе с нами, присылайте свои резюме и портфолио на этот контакт: https://t.me/cryptohr_web3 Будем рады видеть вас в нашей команде!",https://www.work.ua/en/jobs/5751785/
"Junior, Middle Python Developer","MySQL,Git,Python,PostgreSQL,Django,Django Rest Framework,Робота в команді,Програмування,Знання принципів ООП",,Інсайдери,"About the vacavncy:   We are a young and rapidly growing company with more than 100 dedicated and highly skilled developers of various levels. As this opportunity requires working from our office, it is open exclusively to Lviv residents. To apply for this position, you will need to prepare for a technical interview to demonstrate your capabilities, skills, and knowledge.  What we expect from the candidate:    Experience in development using the Python programming language is required.  Knowledge of frameworks such as Django and DRF is necessary.  Understanding of the fundamental principles of object-oriented programming is essential.  Proficiency in working with databases such as MySQL and PostgreSQL is important.  Experience with version control systems like Git is mandatory.  The candidate must demonstrate seriousness and the ability to collaborate effectively both in a team and independently.  What we offer:    Convenient work schedule.  Company-provided equipment.  Friendly office atmosphere designed for comfortable work.  Official employment with a competitive salary, taking into account your skills and experience.  Support from an experienced team of developers and managers.  Exciting projects for you to participate in.  Feel free to contact us now; this could be the beginning of our collaboration! We will respond promptly upon receiving your resume.",https://www.work.ua/en/jobs/5607803/
Python-програміст,"Python,Програмування,Бажання вчитися і розвиватися",20000–30000 UAH,"Глушакова Т. Б., ФОП","Вакансія: Python-програміст Компанія «Глушакова Т. Б., ФОП» шукає Python-програміста з досвідом роботи від 1 року для роботи над проектами зі створення інтернет-магазинів. Робота віддалена, що дає можливість працювати з будь-якої точки світу. Вимоги:  Досвід роботи з Python від 1 року;  Знання базових принципів розробки веб-додатків;  Розуміння роботи з базами даних;  Бажання вчитися і розвиватися в сфері програмування.  Ми готові розглянути кандидатів без освіти, але з відповідним досвідом і навичками.  Якщо ви пасіоновані до програмування, маєте досвід роботи з Python і бажаєте приєднатися до нашої команди, надсилайте своє резюме! Додаткова інформація про вакансію та умови праці надаються під час співбесіди.",https://www.work.ua/en/jobs/5753979/
"Викладач у дитячу ІТ-школу програмування (Роблокс, Python)","Python,Програмування,Креативність",4000–8000 UAH,"Logika, мiжнародна школа програмування для дiтей","Контакти: Тел.  +380938659605 Show phone  (Діана) Що таке Logika: Ми впроваджуємо новітні IT технології в навчання школярів. На наших уроках діти не лише вчаться основам програмування, вони розвивають логіку і вміння думати, а в проектній роботі проявляють креативність та творчі здібності. У програму курсу Logika включені частини курсів з фізики, математики, хімії, астрономії, що допомагає дітям зрозуміти, навіщо шкільні предмети потрібні в реальному житті. Logika активно розвивається і в зв’язку із розширеннями відбувається пошук викладачів! Ми пропонуємо:  Робота у вихідні та будні.  Заробітна плата: 300 грн / 1.5 години викладання.  Постійне навчання за рахунок компанії від наших професіоналів.  Зручні локації.  Круте ком’юніті однодумців!  Хто нам потрібен?:  Потрібні круті викладачі, які ладнають із комп’ютером на «ти» та мають активний підхід до своєї роботи.  Необхідні знання у Python, Роблокс (Або ж досвід із іншими мовами програмування та бажання вивчати нове)  Великою перевагою буде вища освіта в області ІТ, або ж педагогіки/психології.  Якщо Ви маєте досвід у роботі з дітками — це кльово, а якщо немає, то навчимо!  Що потрібно буде робити:  проводити заняття із використанням уже готових методичних матеріалів школи Logika;  створювати та підтримувати дружню робочу атмосферу;  отримувати кайф від роботи із майбутнім нашої країни;  Якщо саме ВИ бажаєте власноруч змінювати освіту на краще — ходім до Логіки! Не втрачай можливість — хутчіш залишай відгук, або ж телефонуй:  +380938659605 Show phone  (Діана)",https://www.work.ua/en/jobs/4609734/
Python developer,"Користувач ОС Linux,Git,JavaScript,Python,Відповідальність,Django,Програмування,Flask,AWS,Бажання вчитися і розвиватися",,Quintagroup,"Quintagroup is a company of  Python/JS/AWS  experts that provides consulting, programming, and support services to organizations interested in deploying cloud-based solutions. We are looking for talented  Python Developers. RESPONSIBILITIES:  development with Python  participation in planning and execution stages  researching and using technologies to implement effective solutions  development of products for customers from the US, Germany, Switzerland   development of serverless apps, e-commerce solutions, marketplaces  REQUIREMENTS:  strong knowledge of Python  strong knowledge of GIT   experience with Linux   desire to develop and learn  English B2  Would be a plus:  experience with AWS, Django, Flask  WE OFFER:  a company with a specialization in Python development for the last 20 years  different domains of projects: FinTech, EdTech, GovTech, IoT, e-commerce, e-auctions, e-learning, public procurement, development of complex AWS based solutions  friendly atmosphere and good working conditions   regular team-buildings and corporate parties  English classes   flexible working hours  experience with new technologies  If you are interested please send us your CV to [ apply ] We will be glad to welcome you to our team=)",https://www.work.ua/en/jobs/1665750/
