title,skills,salary,company,description,link
Intern Python developer,"Git,Python,Комунікабельність,Програмування,Знання принципів ООП,PyQt,Tkinter",,HYS Enterprise,"Requirements:  Proficiency in Python3 programming language;  Understanding of basic software development concepts such as data structures, algorithms, and object-oriented programming;  Familiarity with version control systems, preferably Git;  Passionate about AI;  Good communication skills;  Upper-Intermediate English level;  Based in Ukraine (with the option for occasional office visits).  Candidates who do not meet the stated requirements might not be considered. Would be a plus:  Experience in creating native applications (tkinter, PyQt, etc.);  Experience with embedding models;   Experience with libraries such as crewAI, langchain, langgraph;  Understanding of how transformers work;  Experience working with Hugging Face, gsheet API.  About the project: Our tool helps non-technical specialists create AI agents in CrewAI for business tasks using the Google Sheets interface, bypassing direct coding work in CrewAI.  We offer:  Internship schedule: Monday to Friday, 10.00−19.00  Office-based / remote work;  No time trackers or other bureaucratic measures;  Practical experience on internal projects;   Networking with experienced professionals willing to share their knowledge and experience;   Opportunity to obtain a contract with HYS Enterprise as a Junior specialist.  Gifts for birthdays and professional holidays;  Interaction with experienced professionals willing to share their knowledge;  Participation in internal and external events, the opportunity to build or promote your own brand.  It is important! To submit your application for the internship, please follow the link below and fill out the form:  Intern Python Developer",https://www.work.ua/en/jobs/5644457/
"Python Backend Developer (Ninja, Startup from Germany)","Linux OS user,Jira,Python,PostgreSQL,Communicability,Django,Unit testing,UNIX,nginx,BASH,REST,REST API,AWS,Initiative,ORM,Backend development,Next.js",90000–125000 UAH,CheckForPet,"INTRO: To strengthen our 300-team (This is SPARTA / Code is King, but YOU are the master), we are looking for a Middle/Senior Python Backend Developer Ninja (m/f/d) to start on 1.9.2024. Remote.  With our innovative business model and over 1,000,000 user-generated reviews (UGC) received so far, we are taking the next step by integrating direct sales through a custom-developed checkout and preparing our AI Recommendation Engine for Pet Food. We aim to ensure that every pet gets the right food. Therefore, we are looking for an experienced Python Backend Developer who can take the initiative, knows what they are doing, and can help us scale our backend operations to the next level.  Our goal: Become the #1 pet food recommendation engine in the world. As a Python Backend Developer, you will work with a functional product, already tested and well-running processes, and a modern infrastructure that you can independently develop and optimize.  Your Tasks:  Develop and optimize backend systems using Python and the Django framework   Integrate APIs and third-party services  Further develop and maintain the existing infrastructure  Ensure scalability and performance of web applications  Collaborate with frontend developers and other departments to implement new features  Monitor and improve security and data integrity   Conduct code reviews and ensure quality assurance   Report directly to our CTO and work closely with him and QA  Your Profile:  At least two years of experience in backend development with Python and Django  Experience with relational databases (e.g., PostgreSQL)  Knowledge in working with RESTful APIs and microservices  Experience with DevOps practices and cloud services (e.g., AWS)  Proficient in using version control systems (e.g., Bitbucket)  Familiarity with project management and communication tools like Slack and Jira  Excellent analytical skills, structured work approach, and communication skills  Very good English & Russian skills (additional languages are a plus, German?)   Technical Skills:  Python:  mutable/immutable data types, decorators, singleton, mutable objects as default values for functions/methods, iterators/generators, context managers, resolving import loops, GIL, PEP8, docstrings, unit/functional testing, mocking  Django:  context processors, signals, ORM, optimizing page performance (db, ORM, caching)  REST  Nginx  Bash/Sh, grep, find  UNIX/Linux  Relational DBMS  MUST have I:  You  must have  experience as a Python Developer and count yourself as Middle/Senior level. No bullshit, please. Apply only if you really have what it takes. The assessment center is hard, and we do not want to waste each other’s time. MUST have II:  Please understand that our team has roots in the Soviet Union. We all speak Russian, are against war, and communicate in this language. If this is a problem for you, you should not read further. We keep politics out. Our policy is that of the 300. Sparta! We Offer:  Innovative business model focused on fair and transparent advice for pet owners  Ambitious and growing team -> Became Nr. 1   International environment, fixed workplace in Hamburg, Germany (Headquarter)  Coworking spaces in Kiev, Kharkiv, Ivano-Frankivsk, and Poland   Permanent employment contract, freedom for your own ideas  Opportunities for personal development and career advancement  Family-friendly working conditions  Interested? Please write to us, including your resume, references, and tell us something about yourself in English. Once we have reviewed the applications,  please give us until mid-August at the latest.  Do not follow up. We have received everything, and you will receive feedback by the end of August. Interviews and 1-to-1 meetings will follow, which can be conducted in Russian. We start on 1.9.24. We look forward to you. This is Sparta, and we are the 300.",https://www.work.ua/en/jobs/5746409/
"Backend-developer (Python, PHP)","JavaScript,PHP,SQL,Python,Відповідальність,Організованість,Docker,Selenium,Програмування,Креативність,Symfony,RabbitMQ,NoSQL,Backend-розробка",,"Zviger, LLC","Привіт, майбутній колего! Ми — американська компанія з українським корінням «Zviger LLC», яка надає якісний сервіс підбору авто з США з 2017 року. Організуємо та візьмемо під контроль весь процес — від покупки автомобіля на аукціоні — до вивантаження в пункті призначення. Наш сайт:  https://zvigerauto.com/   У зв’язку з розширенням штату шукаємо Backend-developer. Ключові задачі:  Розробка та підтримка продуктів компанії;  Проведення код — рев’ю;  Оцінка трудомісткості завдань;  Взаємодія з іншими командами: розробниками back-end; розробниками front-end; тестувальниками; аналітиками.  Для нас важливо (наші вимоги):  Мінімум 3 роки досвіду розробки програмного забезпечення  Досвід об'єктно-орієнтованого програмування  Досвід роботи з базами даних (SQL, NoSQL)  Впевнене знання та досвід розробки на Python3  Знання та досвід розробки на PHP (Symfony), JavaScript  Досвід роботи з чергами повідомлень (RabbitMQ)  Досвід роботи з Selenium  Досвід роботи з інтеграціями API, вміння бачити приховані можливості в даних  Досвід роботи з Docker  Базовий досвід адміністрування *nix систем.  Самоорганізованість, відповідальність, креативність, виконавчість.  Ми пропонуємо (наші умови):  Дистанційна форма роботи;  Робота у крутій молодій команді;  Графік роботи: 5 — денний робочий тиждень;  Відпустка: 20 календарних днів;  5 short term sick leave (day off)  Персональна відпустка 3 дні по кожному із випадків: одруження, народження дитини, смерть близької людини;  Бенефіти на придбання авто з США;  Видаємо Eco Flow, щоб була можливість працювати в блекаути;  Компенсація зовнішнього навчання та корпоративне навчання;  Тімбілдинги;  Ми можемо ще багато розповідати, але пропонуємо продовжити вже особисто. Що скажеш?",https://www.work.ua/en/jobs/5714244/
"Python/Django Developer (Junior, Middle)","JavaScript,Git,GitLab,Python,Trello,PostgreSQL,React,Знання принципів ООП,Docker,Docker Compose,Django,Django Rest Framework,Unit-тестування,REST,Selenium,Redis,Знання принципів TDD,ORM,Celery,KISS,Продуктивність,SOLID Principles",,AD Media Profit,"Про компанію: AD MEDIA PROFIT —  ми маркетингове агентство, що спеціалізується на наданні рекламних послуг по всьому світу. Наш відділ розробки відіграє ключову роль у створенні переваг для наших клієнтів, розробляючи та підтримуючи унікальні продукти, що допомагають досягти бізнес-цілей.  Ми шукаємо талановитих спеціалістів на позицію  Full Stack розробника  з досвідом від  2-х років , готових до розробки нової функціональності та підтримки і рефакторингу поточного проекту. Запрошуємо досвідчених розробників приєднатися до нашої команди, щоб спільно створити рішення, яке має потенціал змінити уявлення про внутрішнє управління рекламними командами і внести суттєвий вплив у цю сферу. Про проект: CRM-система закритого типу для внутрішнього використання, що включає бекенд і фронтенд компоненти для повного керування даними та взаємодії з ними всередині компанії і оптимізовує внутрішні процеси.  Мета проекту — створення ефективного інструменту для збору, аналізу та використання даних, спрямований на підвищення продуктивності та координації дій між членами команди.  Наш стек: Python  ( Django/DRF) , JavaScript (React) , PostgreSQL, Celery, Redis, Docker/Docker Compose, Git, GitLab, GitKraken, Trello. Вимоги:  Досвід роботи з  Python (Django)  у веб розробці  від 2+ років  Досвід роботи з  Django REST Framework , написання власних  API  та документації;  Вміння писати та оптимізовувати запити  Django ORM — MUST HAVE. .  Відмінні знання:  OOP, SOLID, TDD, DRY, KISS .   Досвід з  PostgreSQL  або з іншими базами даних   Впевнене володіння Docker та Docker Compose.  Досвід роботи з  React  (або інших фронтенд фреймворків) та практичний досвід роботи в комерційних проектах  від 6 місяців.  Професійне володіння  Git , включаючи знання різних стратегій роботи з гілками ( git flow, branching strategies ), а також досвідчені навички управління версіями.  Хороші технічні, аналітичні навички та вирішення проблем.  Добре знання найкращих практик проектування програмного забезпечення та шаблонів проектування.  Рівень англійської Upper-Intermediate (або вище).  Плюсом буде:  Досвід інтеграції з  3rd party API , зокрема  Facebook  і  TikTok .  Розробка інтеграційних, модульних та юніт-тестів, а також написання тестів за допомогою Selenium для автоматизації тестування інтерфейсів.  Досвід роботи  Redis ;  Обовʼязки:  Підтримка та модернізація існуючих проєктів.  Розробка якісного коду згідно із сучасними стандартами (включно  PEP8 ).  Самостійна розробка функціональності та вміння працювати з великим обсягом технічної інформації.  Швидка адаптація до динаміки роботи команди та своєчасне виконання завдань.  Аналіз потреб, проєктування та розробка нових функцій разом з командою.  Підтримка та рефакторинг існуючого коду, поліпшення процесів розробки.  Вміння та бажання ефективно працювати в команді.  Ми пропонуємо:  Конкурентну заробітну плату  Можливість віддаленої роботи  Гнучкий графік та можливість раціонально розпоряджатися робочим часом  Робота в команді кваліфікованих та досвідчених спеціалістів  Можливість професійного зростання та розвитку   Якщо ви впевнені, що відповідаєте вимогам, описаним вище, і хотіли б приєднатися до нашої команди, будь ласка, надсилайте своє резюме. Також треба виконати тестове завдання.",https://www.work.ua/en/jobs/5629804/
"Викладач у дитячу школу програмування (Python, HTML/CSS)","CSS,HTML,Python,Програмування,Креативність,Викладання,Педагогіка,JavaScript",4500–10000 UAH,"Logika, мiжнародна школа програмування для дiтей","Logika  — це найбільша школа програмування та англійської мови для дітей в Україні  logikaschool.com Ми впроваджуємо новітні IT технології в навчання школярів. На наших уроках діти не лише вчаться основам програмування, вони розвивають логіку і вміння думати, а в проектній роботі проявляють креативність та творчі здібності.  Logika  активно розвивається і в зв’язку із розширенням ми в пошуку викладачів! Ми пропонуємо:  Робота у вихідні (субота, неділя).  Заробітна плата: від 250 грн/2 години  Постійне навчання за рахунок компанії від наших професіоналів.  Готові розробки уроків та методичні матеріали.  Зручні локації.  Круте ком’юніті однодумців!  Хто нам потрібен?  Потрібні енергійні та вмотивовані викладачі, які з комп’ютером на «ти» та мають активний підхід до своєї роботи.   Необхідні знання у Python або ж досвід із іншими мовами програмування та бажання вивчати нове.   Знання верстки (HTML/CSS).  Великою перевагою буде вища освіта в області ІТ, або ж педагогіки/психології.  Кандидати з досвідом роботи з дітьми в пріоритеті, але якщо в тебе ще немає досвіду, але є хист і бажання, школа пропонує навчання і підтримку.   Обов`язки:  Проводити заняття із використанням уже готових методичних матеріалів школи Logika;  Створювати та підтримувати дружню робочу атмосферу;  Слідкувати за результатами учнів;  Давати звіти за шаблонами;  Отримувати задоволення від роботи з учнями — майбутнім нашої країни.  Якщо саме ТИ бажаєш власноруч змінювати освіту на краще — чекаємо серед однодумців в  Logika! Не втрачай можливість — хутчіш залишай відгук, або телефонуй: 0979058537 Show phone  Владислав",https://www.work.ua/en/jobs/5186004/
Senior Python Developer,"SQL,Communicability,Docker,Unit testing,Redis,Backend development,Blockchain",300000–320000 UAH,Web3 AI,"As we continue to innovate and expand, we are seeking a Senior Python Developer to join our team. Position Overview: We are seeking a highly skilled and experienced Senior Backend Developer to join our dynamic team in a full-time capacity. This remote position offers a competitive salary range starting from $6,000, with the potential to reach up to $9,000 for a strong match. Key Responsibilities:  Maintain and support our legacy platform by addressing bugs, refactoring code, and enhancing its stability through comprehensive test and typehint coverage.   Transition to designing and developing new features as the platform evolves.  Collaborate with the team to understand requirements and deliver scalable solutions.  Lead development efforts and projects, take ownership and assume accountability  Required qualifications:  5+ years of experience in Python development  Proficiency in Python and FastAPI with a deep understanding of modern asynchronous frameworks.  Extensive experience with SQL, particularly PostgreSQL.  Fluent in English, with excellent communication skills both written and verbal.  Practical knowledge of Docker, Redis  Proven track record of writing and maintaining high-quality unit and integration tests.  Ability to work in a distributed team  Preferred qualifications:  Experience in golang.  Familiarity with  Ray.io  or similar frameworks for distributed computing.  Familiarity with web3 or blockchain environment.",https://www.work.ua/en/jobs/5674106/
Python Developer,"Користувач ОС Linux,JavaScript,PHP,MySQL,Git,Python,PostgreSQL,Docker,Робота в команді,HTTP,REST API,Розробка API",,Ronis Commerce OÜ,"Наша компанія знаходиться в пошуку колеги —  Python-розробника  для участі в цікавих закордонних веб-проектах. Основні  завдання , які виконуватиме розробник у нашій компанії:  розробка веб-додатків для управління інтернет магазинами  інтеграція зі сторонніми сервісами з API  розробка баз даних  написання додатків для аналізу та обробки даних  Основні вимоги до вакансії:  досвід роботи на аналогічній позиції від 1,5 років  досвід участі у розробці навантажених web-проектів  розуміння основних принципів роботи HTTP та RESTful APIs  досвід роботи з MySQL/PostgreSQL, Docker, Git  вміння писати зрозумілий код  вміння розумітися на чужому коді  досвід роботи в командному рядку Linux  англійська, достатня для читання документації  вміння працювати в команді  знання інших технологій та мов (PHP, Javascript) буде плюсом  Зі свого боку ми пропонуємо:  віддалений формат роботи  гідну та своєчасну заробітну плату, що переглядається за результатами роботи  цікавий та масштабний проект  допомогу на всіх етапах нашої співпраці  роботу в компанії, що стабільно розвивається  натхнену команду професіоналів  підтримку компанії у професійному розвитку.  RONIS це:  одна з провідних компаній з розвитку електронної комерції  компанія, що успішно розробила та просуває власний продукт  сильна команда, що активно зростає.",https://www.work.ua/en/jobs/5088702/
Python developer,"CSS,JavaScript,HTML,Python,Responsibility,Django,Teamwork,Flask,Kubernetes,FastAPI,Django Rest Framework,Git,sql",,4bsystems,"Вакансія: Python розробник Ми, компанія «4bsystems», шукаємо в команду талановитого Python розробника з досвідом від 2 років. Основні вимоги до кандидата:  Глибокі знання Python та його фреймворків, таких як Django чи Flask  Досвід розробки веб-додатків та веб-сервісів  Вміння працювати в команді та брати на себе відповідальність за виконання поставлених завдань  Знання базових принципів роботи з базами даних  Буде великим плюсом:  Досвід роботи з front-end технологіями (HTML, CSS, JavaScript)  Знання англійської мови на рівні, що дозволить комунікувати з іноземними колегами та клієнтами  Відкритість до вивчення нових технологій та готовність ділитися своїми знаннями з іншими членами команди  Ми пропонуємо:  Цікаві проекти та можливість професійного зростання  Гнучкий графік роботи та можливість віддаленої роботи  Дружній колектив та підтримку на кожному етапі роботи  Якщо ви готові приєднатися до нашої команди та приносити користь своїми навичками, надсилайте своє резюме. Чекаємо на ваші заявки!",https://www.work.ua/en/jobs/5721697/
